id,text,oracle
2732,"When i run this API_NAME, their shows only the labels, and No button aor text field.",0
2734,Wrong JSF tags.,0
2741,In order to avoid such problems in future you'd better use some IDE ( e.g. Netbeans IDE or Intellij IDEA ).,0
2744,Use CDI's CODE_FRAGMENT with CODE_FRAGMENT or JSF's CODE_FRAGMENT with CODE_FRAGMENT.,0
2759,"You must capitalize the first letter of the property in the getter/setter, so instead of.",0
2762,Second: you are mixing CODE_FRAGMENT ( instantiation through JSF ) with CODE_FRAGMENT.,0
2763,Older versions of JSF used instantiation through JSF and you should be using CODE_FRAGMENT.,0
2765,"Also to note, when asking questions usually it is worth stating which version of JSF/server/J2EE you are using ( without such information, we can not tell you which annotations you should use ).",0
2770,Do i need to use event mechanism?,0
2775,"Use CODE_FRAGMENT instead, and get this string from a CODE_FRAGMENT.",0
2776,Check here for an example which returns a String.,0
2777,Like this.,0
2779,"If you insist using CODE_FRAGMENT, you can try the below 2 ways.",0
2786,Can anyone please help me out with this.,0
2797,Hoping to get an alternate approach or a small overview of AnchorPane constraints.,0
2798,Note: I'm new to JavaFX graphics library.,0
2806,"running CODE_FRAGMENT isn't enough, running CODE_FRAGMENT after inserting the dependency solved it for me.",0
2809,I would like to keep that original window open throughout when the user is using the File Chooser and after.,0
2812,The file chooser's parent was the main window.,0
2817,DO_NOTHING_ON_CLOSE ( defined in WindowConstants ): Don't do anything; require the program to handle the operation in the windowClosing method of a registered WindowListener object.,0
2828,You absolutly need to be compiling FILE_NAME JRE NUMBER!!,0
2832,"I created the simplest possible android app which starts the RegisterActivity generated by the plugin, where I did plug the ID, Api Key and project number.",0
2833,I then click on the button but I get this error message.,0
2834,"Although, the console tells me that there is one instance up and running and the LOCAL_ANDROID_RUN variable in FILE_NAME is set to false.",0
2836,How is that possible and what can I be doing wrong?,0
2837,Thank you a lot in advance.,0
2845,The same number is: 2.,0
2855,Use this logic it will work for consecutive same values otherwise use ArrayList.,0
2880,drl file for creating new rules and modifying rules.,0
2881,What exists for programmatically creating new rules from Java?,0
2883,"I don't know if this is the `accepted 'way, but with the following code I comine CODE_FRAGMENT files with programmatically created rules in Drools 6.",0
2886,The following comment is found at the Java documentation.,0
2896,Adding API_NAME ( ) after awaitTermination ( ) method call can provide a delay which can get you the output you were looking for.,0
2897,I took help from this Question.,0
2901,System prints data like this.,0
2910,If not I just wanted to know if Java serializes objects that haven't been initialized yet.,0
2914,"So, basically you write primitives ( e.g. CODE_FRAGMENT ) or objects ( CODE_FRAGMENT ) with the CODE_FRAGMENT and then you read them back using the CODE_FRAGMENT with the corresponding CODE_FRAGMENT-methods.",0
2918,You can try use byte [ ] instead of String object.,0
2920,Each String object contains set of UTF-16 chars.,0
2921,It means 2-bytes per symbol in most case.,0
2922,"UTF-8 encoding uses one byte for ASCII, two bytes for many europe languages.",0
2923,Also each String object contains reference to char array.,0
2926,"So you can easy reduce count of objects by factor two ( one byte [ ] instead of pair String + char [ ] ), and array length of UTF-8 symbols usually less than length of UTF-16 chars.",0
2941,And then in your other file.,0
2948,"Assuming that the only issue you're having is the name of the dependent library, see CODE_FRAGMENT.",0
2951,"But this library has a dependency to other native library, which cames bundled with the API_NAME.",0
2959,"In the debug outputs of JNA i can see, only the API_NAME will extract from FILE_NAME package.",0
2963,I have looked to the JNA code of the extraction method.,0
2983,Please see attached cause exception.,0
2988,"You don't you get Neo4j cross-compiled to the client, you have to run Neo4j as part of your backend service.",0
2994,You can look at the readme document on Github repository to get started.,0
2995,Sample code on working with blob can also be found in the repository here.,0
2997,I am using Android Studio.,0
3002,The logcat is as below.,0
3003,Can anyone tell me where I am going wrong?,0
3007,FILE_NAME project is called Osmosis and contains 2 packages search and common.,0
3015,My API_NAME seems to include the reference.,0
3020,Add CODE_FRAGMENT after your other two CODE_FRAGMENT lines in your CODE_FRAGMENT.,0
3029,"As well, I am adding a set amount of Labels using an array and a for loop,.",0
3031,I have tried using both a VBox and an HBox but I am not able to see a difference in my result.,0
3032,I have also tried to use.,0
3037,( In this case I would have used.,0
3050,Quick fix is to make the VBox as the parent of the StackPane.,0
3055,"so, how we can parse above like example expression easier, or FILE_NAME api for string parser.",0
3076,This uses ByteBuffer's CODE_FRAGMENT method.,0
3080,"Now I want this, when the user check a shipper by EditTextView, I have from database an Object.",0
3081,I want insert the information of this object in the Fragment.,0
3082,"Now in the onCreate method I have insert in all tab, the FILE_NAME, but I will to create three FILE_NAME for the three tabs.",0
3084,"So instead of setting Bundle to null, you can do something like this.",0
3085,Check out this link for more info.,0
3099,"I did not remove sunpkcs # 11 provider after each API_NAME (... ) call,.",0
3106,"This exception is not because of absence of SunPkcs11 because i see the SunPkcs11 that i added, in the providers list.",0
3107,I'm new to FILE_NAME language.,0
3126,"In Java, you typically don't write a single method that handle all sorts of arguments with all sorts of different types.",0
3135,Autoboxing is syntactic sugar. ),0
3145,"If you want to implement a dynamic binding between names ( strings ) and values in Java, use a FILE_NAME.",0
3163,So just use CODE_FRAGMENT instead of CODE_FRAGMENT.,0
3193,When I perform CODE_FRAGMENT request to CODE_FRAGMENT I get following JSON.,0
3212,I `am using library CODE_FRAGMENT for work with CODE_FRAGMENT file's.,0
3224,"Then you can do what you want with the Collection: sort it, loop through it, create a Comparator etc..",0
3232,I was thinking of creating a new JSONArray object and copy node which contains Carlos.,0
3238,You'll need to use a regex for for the CODE_FRAGMENT path expression.,0
3250,I am doing a small project it is a interoperability FILE_NAME and.,0
3256,The program is just a hello world Program.,0
3267,You create a reference type by prefixing FILE_NAME declaration with CODE_FRAGMENT keyword.,0
3269,CODE_FRAGMENT is what you use to create an object in managed heap.,0
3282,"( Note that nodes may have multiple style classes, though I have never understood why this is a CODE_FRAGMENT rather than a CODE_FRAGMENT. )",0
3288,"Finally, ID Selectors work by specifying an id on the node.",0
3290,So you can do.,0
3294,One last note: you mentioned that your line ``lacked API_NAME ''.,0
3300,The code in Java is.,0
3302,What you need is to assign data to a string read from the stream.,0
3321,This is a question just to satisfy my curiosity.,0
3322,Consider the following two Java regular expressions: CODE_FRAGMENT and CODE_FRAGMENT.,0
3323,Are they equivalent?,0
3340,"I went on and assumed you meant to quantify it as greedy, hence the CODE_FRAGMENT in my example, instead of non-quantified CODE_FRAGMENT in your question.",0
3341,They are equivalent when you use them as is with CODE_FRAGMENT.,0
3346,I like working with eclipse better than Android Studio.,0
3352,So I first tried to compile the sweet-alert-dialog project and I found out that I need to first somehow include the materialish-progress.,0
3359,Try to download *.,0
3361,"May be some resources will need to be copied from archives, too.",0
3368,Let me know if there are any other details that might help!,0
3370,Dug this up: WEB_ADDRESS.,0
3372,Guess I'll be trying to find a creative workaround in the meantime... The proximate cause of the failure is that there are more than 5 levels of subdirectories under.,0
3389,Provide path from src or bin to file location ( Running from eclipse ).,0
3393,For more Information: WEB_ADDRESS.,0
3395,I needed to write a program which adds binary numbers as if they were decimal.,0
3407,"If you want to print a int as binary, use CODE_FRAGMENT to get the string representation of a CODE_FRAGMENT in binary.",0
3409,Version of Spring is NUMBER.,0
3410,"I have a session bean, declared as.",0
3413,"After debugging, i found out, that when test spring context is started, in the.",0
3422,"You can add a util method to your test, something like.",0
3426,In production I would assume that you are configuring either a CODE_FRAGMENT or a CODE_FRAGMENT.,0
3429,See JIRA issue SPR-13217 for details.,0
3432,"However, having said that, if you have a concrete need for modifying the mock request created by CODE_FRAGMENT manually and then having that re-used with CODE_FRAGMENT, you can create the FILE_NAME in your project.",0
3435,"Obviously, the above example re-implements CODE_FRAGMENT, but you can naturally do the same for CODE_FRAGMENT, etc..",0
3438,Sam ( author of the Spring TestContext Framework ).,0
3445,And DispatherConfig is this.,0
3446,Let's assume that we have a for-loop that will loop through a collection or array of Strings.,0
3448,hey ) here's how I usually achieve that.,0
3453,Let's put your code inside a method.,0
3454,"If you use CODE_FRAGMENT, the loop will terminate and CODE_FRAGMENT will be reached.",0
3457,If you know the word can only be found once you can surely place an break; statement so the loop won't continue after finding the match.,0
3462,"The application is a Spring/Hibernate webApp, which access the Oracle database.",0
3463,This was configured in an API_NAME as follows.,0
3464,Question is of course: what is a solution to use the result of Oracle function for the new value of the ID?,0
3468,"Edit: To call an Oracle function from Java, see if this works for you.",0
3469,Call Java Oracle Functions From Java program and see the Java CallableStatement API.,0
3472,"When I run this on Windows, the console tells me.",0
3484,Does CODE_FRAGMENT work?,0
3487,"Note, however, it's called CODE_FRAGMENT, with a capital D.",0
3492,Question 2: From the javadoc.,0
3493,"So yes, you need to keep track of the position yourself.",0
3502,But when I run this json through CODE_FRAGMENT I see that CODE_FRAGMENT been replaced with CODE_FRAGMENT.,0
3510,What happens if a thread has been executed same time more than once.,0
3514,"Something like below,.",0
3524,Hope it clarifies.,0
3539,I have to fetch time stamp from DB and retrieve only time and compare two time.,0
3548,Which outputs.,0
3553,I have a string like this.,0
3554,Now i want to translate the string FILE_NAME entity decoder.,0
3556,url WEB_ADDRESS.,0
3557,is there FILE_NAME api to translate it?,0
3564,I'm using it to convert huge lists of strings with HTML entities in them back to normal strings.,0
3568,And I got the output like this.,0
3577,mm stands for minutes.,0
3584,"So, using... It outputs CODE_FRAGMENT for me.",0
3589,Accourding to this answer.,0
3592,IS there any way so that I can open using the code itself.,0
3596,and call the client as follows.,0
3598,The `API_NAME 'property represents an estimate of the number of words in the Word document.,0
3599,API_NAME updates this property when you call `API_NAME 'method.,0
3600,Please see the following sample code.,0
3605,en-dash & em-dash word count differs from MS-Office.,0
3616,Hi I have a sample log file here.,0
3630,"The API_NAME ( String regex,.",0
3632,You need to encapsulate the regex pattern in quotes.,0
3634,The line that uses the CODE_FRAGMENT method should look something like this.,0
3656,"To stop this runnable, you have to call this when needed.",0
3661,And a string contains the name of the enum.,0
3665,You have to do it like this.,0
3666,Here's an alternative way.,0
3669,Remember you should use FULLY QUALIFIED CLASSNAME.,0
3683,Here is the actual data sent.,0
3703,I think you also have to look at the database configuration.,0
3709,The package gets deleted in the registry.,0
3719,"install4j transforms entered package names to path names, so ''.''",0
3730,Using FILE_NAME I can do something like this.,0
3737,Any suggestion for a better design would be appreciated.,0
3739,"If call is successful, the onResponse ( ) method is called.",0
3740,"If after retrying for set amount of repetitions call fails, onFailedAfterRetry ( ) is called.",0
3743,I'm trying to inject a DAO using @Autowire.,0
3750,Any advice is welcome.,0
3752,FILE_NAME is instantiated inside an ItemProcessor bean ( spring batch ).,0
3753,Let's say that I have an Android library that has FILE_NAME Foo in it.,0
3755,You can also retrieve the item by calling API_NAME ( ``Test1 '') and it will return the item associated with Test1.,0
3758,In App 2 if I call API_NAME ( ``Test1 '') will I get a null pointer exception or will I get 1?,0
3759,"I am not sure exactly how static classes in included libraries work, scope wise.",0
3761,I am curious about the problem I have proposed.,0
3768,Thank you in advance!,0
3772,"That being said, the JARs you see there only support JPA, not core Hibernate.",0
3780,"But, i didn't give me the thing i need!",0
3781,How can i do that?,0
3785,"Since CODE_FRAGMENT is a meta character, and it's have a special meaning in regex.",0
3788,What method should I use to update existing ldap objects?,0
3790,Person repo interface.,0
3797,I have integrated sonarQube for code analysis.,0
3811,What do I need to change about the way I package my app so it can just use the latest Java?,0
3824,You should use a CODE_FRAGMENT for this task.,0
3844,"If so, then how far does this go; for example, could a static final field be accessed by one thread before it's been initialized by another?",0
3847,I'm trying to compile a tool which uses apache ant on linux.,0
3851,I also have set JAVA_HOME.,0
3855,"Use full path in ANT_HOME, eg.",0
3856,It dependes where it is exactly located.,0
3865,Thanks and Greeting!,0
3872,So the question is.,0
3887,"If you are using a PaaS ( like Heroku ), they usually provide a way to setup environment variables using their interface.",0
3888,This way this variable get configured in every instance you use.,0
3894,try this type code.,0
3899,In the CODE_FRAGMENT listener we can determine which button was clicked.,0
3901,and call this at every button: ( saves you the setOnClickListener ).,0
3905,"If you add a method to do the CODE_FRAGMENT and CODE_FRAGMENT, you can reduce the lines for each button from two to one.",0
3907,"If you need to shorten the button code, Use View's in OnClick ( ) with help of switch statement.",0
3909,Create the number of buttons that you want with different button id.,0
3915,You can use syntax like.,0
3916,I am trying to write missed responses to an external text file.,0
3919,"In your code, you need to replace.",0
3920,Where the extra parameter CODE_FRAGMENT is to enable the append mode.,0
3921,"Which creates the file writer in append mode, see the docs here.",0
3928,Here is a MacOSX MenuBar.,0
3929,Below is my code.,0
3931,I am running the program as a Java Application.,0
3937,Some technical details.,0
3938,I am using Java SE version NUMBER.,0
3939,My computer's OS is Mac OS X NUMBER.,0
3948,You can see in the code above I use this to call my bean in the other proyect.,0
3950,I also tried using this.,0
3959,Wildfly Developer Guide.,0
3963,The code i am using is.,0
3966,Assume you have this directory layout.,0
3983,What's happening?,0
3992,I've also verified previous GC logs and found that this issue was not forever.,0
3993,"It started about a month ago, after a deployment.",0
4001,CODE_FRAGMENT informs Java VM when CMS should be triggered.,0
4004,"As part of GC, first minor GC is triggered.",0
4007,I have found one more related SE question: CMS garbage collector - when does it run?,0
4013,"So there are a few possible causes to your woes and I'll state the likely quick fix first, and then state some best practices below that you should consider doing in the long term.",0
4018,You should be able to do this by adding the parameter CODE_FRAGMENT.,0
4020,"Also, based on what I can see from Stas' blog entry on the subject, the unit is milliseconds, not seconds.",0
4021,Try these longer term things in the long term.,0
4022,"If you can, try the G1GC collector.",0
4023,"You are using Java 7, so if you can in your current environment, give it a try.",0
4024,It's meant for performance with big heaps.,0
4030,"Remember, the bigger the heap, the longer the garbage collector takes, irrespective of whether you are using a concurrent collector such as CMS.",0
4031,You have a lot of tuning parameters and I would challenge that you need the majority of them.,0
4038,Here is the FILE_NAME implementation.,0
4043,At first we need to check that type is actually inherits from CODE_FRAGMENT.,0
4046,"You can achieve everything @Vadim Martynov's answer does with an additional type parameter and additional type constraints, and still receive compile-time verification.",0
4047,One way would be.,0
4050,"FILE_NAME does one thing, and does it well.",0
4052,"( If you're not using Java 8, it's easy enough to write a CODE_FRAGMENT which takes an existing one, and a CODE_FRAGMENT which takes two existing ones. )",0
4054,You can also use Java 8's static methods in CODE_FRAGMENT.,0
4060,Thanks alot!,0
4062,"So if i changed the 1st comparator to sort by name, not price, the 2nd will changed as well, but not the opposite!",0
4064,Runnable example ( adapted from answer to your previous question ).,0
4066,"I want update text by line number,.",0
4067,for E.g. I want to change text in number 2 into.,0
4070,I have to implement gtalk like chat application using UDP FILE_NAME.,0
4075,Check TextSamplerDemo.,0
4078,Chat window using JTextPane no images though.,0
4082,The unicode for white smiling face is\ u263A.,0
4088,Adding API_NAME-api-API_NAME resolved my NoClassDefFoundError.,0
4089,FILE_NAME does not get listed in the maven dependency tree.,0
4107,iml file if anyone is curious how Intellij is viewing this module.,0
4108,I develop Cursive.,0
4130,"NUMBER mapping-file, FILE_NAME-file, FILE_NAME, exclude-unlisted-classes.",0
4132,So I obtained the following project structure.,0
4133,I modified the ``API_NAME ''file.,0
4168,safety and scope beans to current thread.,0
4172,As you can see some of the code is generated at runtime in methods by CGLib enhancer.,0
4175,Any suggestions or interesting links appreciated!,0
4178,And all injections occurs just once - on application starting.,0
4182,"Let's find out, how scoped beans do work.",0
4189,"Now, about scoped proxies.",0
4191,"This means, that every time you will operate on the exact same object, that was originally injected on start.",0
4194,"To do it, as said in documentation, declare you bean as proxified.",0
4197,CODE_FRAGMENT working almost same way.,0
4204,The text file has 10 lines of data and each line contains a piece of data in the format of: ``Integer1-String1: String2 ''example:`` 123-ABC: DEFG''.,0
4212,You might want to create a FILE_NAME for your data.,0
4224,Obtain the raw lines and keep them in a ( Clojure ) lazy sequence.,0
4247,On the right side of notification android is showing time.,0
4252,Refer more than here: WEB_ADDRESS.,0
4257,"Currently, I create the index like so.",0
4260,Any help will be greatly appreciated.,0
4263,Create your index like so.,0
4264,And here is how you can get back the term vectors from ES.,0
4266,To get the terms we parse the TermsVectorResponse as follows.,0
4274,Why not?,0
4277,"What you probably want is CODE_FRAGMENT, which returns CODE_FRAGMENT if the cursor is not at the beginning of the result set OR if the result set is empty.",0
4278,"It isn't, not at least at JPA level.",0
4283,This triggers a CODE_FRAGMENT on other tables/entities.,0
4284,( note: CODE_FRAGMENT is my JPA implementation ).,0
4292,"Currently, I have a method.",0
4293,"The reason I do not want to have method to accept Reader is that, I want my own method to have own control to decide what type of encoding should be used.",0
4307,"CODE_FRAGMENT is just going to close the stream ( via a CODE_FRAGMENT, in fact - at least in the JDK 6 implementation ).",0
4310,"There's basically nothing to clean up apart from the input stream and structures in memory... the GC will take care of the memory, so you're done.",0
4313,All of that can just go.,0
4327,I have set up the Interface as follows.,0
4330,where mOut is an ActivityInterface.,0
4332,If I make the toString method static I get a different error in the FILE_NAME.,0
4341,Remember to have a CODE_FRAGMENT clause.,0
4353,"That is why it says ``Non-static method toString ( int, int ) can not be referenced from a static context '', because you are trying to access a method which is not static in a static way.",0
4358,Also you need not need SimpleDateFormat to increment calendar details.,0
4362,I inject the beans with AutowireHelper.,0
4378,"Recently, I tried to implement the AppBarLayout with tabs.",0
4380,I also modified the scroll flags: CODE_FRAGMENT.,0
4382,And here is the result in an emulator.,0
4385,Here is the XML layout.,0
4386,There's some configuration settings that look like they can be defined for the ObjectMapper that controls the behaviour of the root element.,0
4387,WEB_ADDRESS #UNWRAP_ROOT_VALUE - see FILE_NAME #WRAP_ROOT_VALUE as well.,0
4389,Config example for spring is available at.,0
4391,I have defined an object CODE_FRAGMENT and in my controller I have.,0
4395,How do I achieve this?,0
4398,Is there a configuration for Jackson/Spring that I am missing?,0
4400,The complete error message is.,0
4401,Just use CODE_FRAGMENT instead of CODE_FRAGMENT.,0
4403,I tried below code and I got this output.,0
4409,HashSet ( Java Platform SE 8 ) says.,0
4413,"We have a requirement to show only -LCB- RED, BLUE -RCB- in a certain user interface?",0
4415,see CODE_FRAGMENT.,0
4420,See from Javadocs of String #compareTo.,0
4422,I have a service which writes input stream to a file.,0
4426,FILE_NAME: 30 line is basically CODE_FRAGMENT.,0
4429,"As I read more into the article, I see that there is an API that looks like this.",0
4430,"If I invoke this API using something like CODE_FRAGMENT and build my request like so, ( provided that I have authentication headers and a POST body included ).",0
4431,"Would I in theory, be able to send a notification with whatever information I want to that device?",0
4442,If you use the XMPP protocol.,0
4443,You should implement a connection server that manages the connection to FCM to handle upstream and downstream messages.,0
4453,Applet and JSP Communication.,0
4454,I have tomcat hosting my website FILE_NAME api for database management.,0
4458,Anyone have any idea on the problem?,0
4462,I know the question is very broad but please help me thanks.,0
4469,You can read more about it here.,0
4470,i'm trying to convert my date which is in string form to date.,0
4477,Either pass 4 digit year or fix your pattern.,0
4478,Maybe i found a solution to your problem.,0
4485,"Dependencies are: tomcat-embed-core, tomcat-embed-websocket, tomcat-juli and because of ( Spring websocket example - error - Are you running in a Servlet container that supports J SR-356? )",0
4489,Thanks in advance!,0
4490,I am writing a cloud-sync application in Java with.,0
4496,P.S. Tha last question for this is 4 years old so there is eventually a new solution for modern systems with java8 in combination with a native.,0
4498,Thank you for any hint.,0
4499,I just found a solution for Java NUMBER + in combination with native and jni dlls.,0
4507,In my CODE_FRAGMENT script I have.,0
4508,"The repository description on MVNrepository lists several compile dependencies, including Selenium-Chrome-Driver, Selenium-FirefoSMILE_FACEriver, etc..",0
4513,The image below shows that it's being compiled from the Maven script.,0
4516,"So in order to instantiate ChromeDriver, you need to.",0
4522,How to do that is explained here.,0
4527,You don't have to base64-encode the access token before use.,0
4532,"Later I came to know that wrapper classes like Integer, Boolean, Character, etc are immutable by nature, so why do we need Atomic * classes like AtomicInteger or AtomicLong.",0
4544,Concept of atomicity comes when something is mutable.,0
4556,The only scenario I can think of is some a application container that has been requested to abort some work.,0
4568,"When you add 3 hours, you will get March 30, 2010 02:00 UTC.",0
4572,"Precisely at March 30, 2010 01:00 UTC we switch time from +1 hour to +2 hours versus UTC, so March 30, 2010 00:59 UTC is March 30, 2010: 01:59 CEST, but March 30, 2010 01:00 UTC become March 30, 2010 03:00 CEST.",0
4575,In a week you can expect another ``fun ''.,0
4580,"That's exactly why you should always store date and times in relation to UTC and convert them to local time zone before displaying, otherwise you risk an ambiguity.",0
4583,"Here is an example ( please, note that March 30th 2008 is Daylight Saving change in Italy ).",0
