id,text,oracle
858,I the next best thing I've found so far is to project the byte buffer as a CODE_FRAGMENT and call CODE_FRAGMENT.,0
866,What about CODE_FRAGMENT and calling CODE_FRAGMENT on the returned CODE_FRAGMENT.,0
870,"CODE_FRAGMENT is made of CODE_FRAGMENTs, not CODE_FRAGMENTs.",0
877,I feel like there should be some way of doing this with the FILE_NAME but I can't figure out a way to use it to get properties from an entity.,0
879,Thanks in advance.,0
882,FILE_NAME is only useful if you are using standard Java beans naming conventions for accessing the properties of your entity.,0
883,What you'll want to do is get the CODE_FRAGMENT of FILE_NAME using the CODE_FRAGMENT method then use the CODE_FRAGMENT method of the CODE_FRAGMENT to retrieve all of the ``getter ''methods of the bean.,0
886,You also do not have to hardcode anything like CODE_FRAGMENT or CODE_FRAGMENT in your reflective code.,0
888,This example compiles and runs.,0
893,This is what I have so far.,0
895,Then it's up to you to add the relevant code to the method body.,0
897,Add a listener to your ``Submit ''button.,0
898,Note that ``myLabelForShowingTheOutput ''is the JLabel you want to print.,0
903,Is it possible to divide two integers to make and make a BigDecimal out of it?,0
907,I was wondering if it is possible to do something like this.,0
911,"In a word, no.",0
913,I've a program test to see if the user input is a positive number and an integer.,0
921,Try this.,0
924,Load the PDF into memory and parse the content using a library like iText.,0
934,"convert PDF to SVG characters with font, size, x/y, etc. ( PDFBox does this ).",0
937,attempt to interpret the areas as cells of rectangular tables.,0
944,Something like this.,0
945,"The answer from @hyde is valid, but I have two extra notes that I will point out in the code below.",0
946,Of course it is up to you to re-organize the code to your needs.,0
948,Hibernate related maven conf.,0
949,Suggestions that I found were.,0
954,Regarding your 6 points.,0
956,User hibernate validation 4 +.,0
959,It is integrated in Hibernate 4.,0
967,"You do that explicitly, but they are also a transitive dependency to hibernate-validator so you would get them either way.",0
968,"No, that not required/related.",0
973,How do you use all these dependencies?,0
976,That's the whole purpose of GUIDs.,0
980,If your ``GUID ''is a CODE_FRAGMENT then the probabilities are quite low.,0
989,Any ideas?,0
1002,"Also, the compiled library is available by adding the following to API_NAME.",0
1005,And I see lot of demo and sample code about broadcasting with CODE_FRAGMENT.,0
1018,You can try this one: WEB_ADDRESS.,0
1020,It supports API_NAME NUMBER + clients.,0
1024,"So, to send a message to specific socket all you need is to call CODE_FRAGMENT.",0
1030,Any tip?,0
1032,You could check whether your CODE_FRAGMENT also is an instance of CODE_FRAGMENT.,0
1042,thanks in advance.,0
1051,Throw a specific/custom exception and set a specific CODE_FRAGMENT for that.,0
1061,"Lastly, if you use tomcat, you might want to clear the work directory with the temporary compiler outputs of the jsps you created.",0
1063,The source code is.,0
1072,Has anyone ever tried to connect to a Yahoo Store using Yahoo API calls from Java?,0
1075,I was able to figure this out.,0
1085,Get the path of sd card.,0
1091,If I have a array with 3 profiles.,0
1094,Any ideas are appreciated.,0
1107,"No-one's picked this up, but why are you trying to mock private methods?",0
1111,Why don't you try Easymock or Mockito.,0
1124,"jMock, mocking based on Hamcrest Matchers.",0
1128,"Even Java5's support is going to end in two days ( 30 October 2009, that is! )",0
1133,Here is a code that I have written.,0
1134,When I open the file API_NAME it contains a single line of data.,0
1142,See the documentation of FileWriter.,0
1149,You can't access a private method from an FILE_NAME.,0
1160,Then you can also add additional access paths to the stuff you want.,0
1166,you can use a CODE_FRAGMENT.,0
1168,for problem number two are you adding anyting to the list.,0
1175,"Now I was thinking of creating FILE_NAME progress page, which would sleep for 5 seconds, then generate a request and supply it with the filename that we want to know the progress of.",0
1177,Maybe JavaScript can do the desired actions?,0
1180,Poll the server ( requires a progress API ) periodically ( via javascript ) for the processing status and update the page accordingly when you get a positive result.,0
1184,"On the client side, you check the progress every few seconds until you see it's finished.",0
1191,"You can add an onClickListener to the ImageViews in the FILE_NAME, something like this.",0
1193,Hope that helps.,0
1199,"to get this index, use getElementIdx ( col, row ).",0
1205,Here it is.,0
1206,Declare below string FILE_NAME.,0
1208,This video ID will be of next thumbnail which will be flipped.,0
1212,or if your goal is to wrap an existing method that does declare its exception.,0
1221,You can try and do nothing about it.,0
1224,"( Come on, put at least a CODE_FRAGMENT there - Logging is the best practice here, as suggested by @BaileyS. )",0
1231,"Only unchecked exception, compiler can skip to check.",0
1240,There are 3 things you can do.,0
1275,The short instruction is.,0
1277,Inside eclipse installation folder go to FILE_PATH.,0
1281,"Suppose to have an FILE_NAME, say CODE_FRAGMENT, and two non-abstract subclasses, say CODE_FRAGMENT and CODE_FRAGMENT.",0
1283,E.g. I get an array of CODE_FRAGMENT objects.,0
1284,which someone converted to a JSON string as follows.,0
1285,"Finally, if I try to deserialize as follows.",0
1294,I convert the SVG file into a w3c Document.,0
1297,API_NAME: API_NAME ( ) FILE_NAME / lang/String;.,0
1298,My code is as follows.,0
1299,My dependecies for apache Batik in API_NAME is as follows.,0
1302,documentation of using the DOM api.,0
1306,Currently I'm working on a school project for a Java course.,0
1310,Change the double quotationCODE_FRAGMENT to to a single quote CODE_FRAGMENT like this.,0
1316,"That said, you should be using prepared statements.",0
1321,"I have a project that is using Apache POI, and I made sure to include all the external JARs.",0
1327,You will need to provide classpath in Jar file's manifest file.,0
1328,See this official doc.,0
1335,"When the CODE_FRAGMENT command fails, it's almost always because of one of two things.",0
1337,"Make sure FILE_NAME dependencies in your manifest file point to jars, relative to FILE_NAME's parent directory.",0
1339,Ensure FILE_NAME contains CODE_FRAGMENT or that your manifest hierarchy points to FILE_NAME that contains FILE_NAME.,0
1341,You should see your CODE_FRAGMENT folder there containing all the required dependencies ( including Apache POI ).,0
1343,"About having FILE_NAME dependencies in a separate folder, as you suggested, that's also possible.",0
1344,Imagine your dependencies where stored in a CODE_FRAGMENT folder outside your CODE_FRAGMENT.,0
1346,It simply adds all the.,0
1347,jars within lib / folder to your classpath.,0
1351,i have found out that i have to read the error log.,0
1359,For testing I've created a.,0
1369,For versions and dependencies please see the API_NAME at the bottom.,0
1370,"With Spring 4, it's now possible to use TestPropertySource.",0
1372,In addition to Biju Kunjummen answer.,0
1374,I'm new API_NAME and trying to make a simple client-server app.,0
1375,here is the server code.,0
1377,How to fix it?,0
1381,Look the documentation of InputStream #read ( byte [ ] b ).,0
1385,You should always check the return values of functions for error conditions.,0
1395,In the future study the input and the output of your systems carefully.,0
1409,it can be found here.,0
1410,Good luck!,0
1412,I'm considering making an Android app that integrates OData also.,0
1414,I'm developing a mobile application.,0
1422,"I did some modification and in the end it was working, but it does not support odata functionallity ( queries like $filter, $oderby,... ) and for each request I need a new instance.",0
1425,Then I tried my own implementation with CODE_FRAGMENT and CODE_FRAGMENT classes.,0
1427,So the question is: Is there another library you can recommend that I missed?,0
1432,The mentioned components generate a CODE_FRAGMENT.,0
1442,"If you want content, use the CODE_FRAGMENT element ( which isn't a void element ).",0
1454,"As long as your configuration doesn't change, you can create the Session once at the beginning and jsut keep using it.",0
1472,"I created a library project, exported it to a JAR file, and added to the build path of a couple of clients.",0
1482,Important is that you use the right names for packages.,0
1483,They should be unique!,0
1490,I'm using netbeans for FILE_NAME coding.,0
1491,"Additionally, the CODE_FRAGMENT is never called.",0
1492,Any pointer why this keeps happening.,0
1513,FILE_NAME has a few abstract methods of its own.,0
1518,"CODE_FRAGMENT return an instance of type CODE_FRAGMENT which also CODE_FRAGMENT, but overrides some of the methods, including CODE_FRAGMENT and CODE_FRAGMENT.",0
1531,"Then I see, that criteriaBuilder don't have method createCriteriaUpdate.",0
1532,Does anyone know how to resolve this problem?,0
1533,You might have both JPA NUMBER and JPA NUMBER persistence jars on the classpath.,0
1545,As per the Java doc.,0
1547,and the attributes inside context object will also.,0
1548,"It will return the same context object, it will not create a new object.",0
1553,The best I've come across so far ( challenge 2 here ) is.,0
1567,I've updated the example per the comment from Holger.,0
1570,No storage.,0
1574,The resulting list contains ``Erik ''only.,0
1580,u can do FILE_NAME.,0
1587,Also CODE_FRAGMENT shortcut is used.,0
1593,Note: I am a committer for Eclipse Collections.,0
1598,"Since guava 21, you can use.",0
1608,The JUnit task page lists several ways in which you can make the FILE_NAME available to Ant.,0
1611,I am attempting to get my JUnit tests for an Android application running using Ant.,0
1612,"While using Eclipse, it is no problem, all is compiled and can be run with no problem.",0
1625,I appreciate your help.,0
1646,"If it is 1 then updateBar will be called once, if 2 then updateBar will be called twice etc..",0
1655,"Unrelated to that bug, but a bug still, you should not create swing components outside the event dispatch thread.",0
1656,It's best to do it right from the start.,0
1665,Please help me if any changes can be made to the code.,0
1666,Problem is pretty API_NAME.,0
1668,You need to create DSN in windows 7 using following steps.,0
1669,click on ``Start ''button - > click on`` Control Panel''.,0
1673,Select ``User DSN ''tab.,0
1674,new window open.,0
1675,( note: select path from: c: / program file/smart solution/weighning management/system/API _ NAME ).,0
1682,Use Type 4 Driver - Database-Protocol Driver ( Pure Java Driver ) as it is 100% pure Java.,0
1684,Types of Drivers.,0
1703,In the tutorial they are using ``Google plugin for eclipse ''to build and deploy the application on to the App Engine.,0
1707,Will it mean I can not use OAuth2 redirect URL will developing?,0
1714,"For example date like CODE_FRAGMENT should be converted to 13 February, 2013.",0
1717,Using CODE_FRAGMENT.,0
1731,can be found here.,0
1739,I am completely newbie to this topic.,0
1744,My task is the following.,0
1751,"Once you have the CODE_FRAGMENT, you can get to the CODE_FRAGMENT and the public and private keys.",0
1754,Something along the lines of.,0
1767,"You need an RSA key for encryption, maybe you can switch your signature algorithm to RSA/SHA1 to avoid the need for two keys.",0
1769,You do not need to do anything special.,0
1772,Can you do something like this were Java is FILE_NAME library.,0
1779,How should I make it to get additional string input such as another user's id?,0
1780,use CODE_FRAGMENT.,0
1786,Using CODE_FRAGMENT;.,0
1787,An example is as follows.,0
1789,I want to list all album list from my picasa album.,0
1792,Please help.,0
1794,"i have an arraylist of objects, each containing a year/month/day / hour property.",0
1825,Any help appreciated.,0
1835,You can then iterate through each departure element.,0
1841,Here is an example of a row from the timetable.,0
1847,"Sorry, should've added more.",0
1848,keyboard is what I named the Scanner.,0
1849,This prints ``Press Enter ''to the console and makes sure the input box is empty.,0
1850,"If they press Enter it should break the While loop and move onto the next statement, right?",0
1853,The CODE_FRAGMENT method will block until it can read a token.,0
1856,"When the line is empty, it will return an empty string, CODE_FRAGMENT, not CODE_FRAGMENT.",0
1861,you need to have FILE_NAME in your classpath in order to reslove this.,0
1865,Here is the FILE_NAME.,0
1866,And here is the FILE_NAME.,0
1871,"I've separated the loop body into two statements for clarity, but it's equivalent to.",0
1876,Your fields should generally be private.,0
1877,Add public ``getter ''methods where necessary.,0
1880,and to declare getters and setters for you fields.,0
1882,"And in your constructor, If you closeley look.",0
1890,I want it to use id instead.,0
1892,"I have the same problem, I think it caused by CODE_FRAGMENT's proxy.",0
1895,then you will get CODE_FRAGMENT.,0
1906,You need to inject LocalSessionFactoryBean into ObjectMapper.,0
1909,I resolve it in my branch in github using CODE_FRAGMENT annotation.,0
1918,Is any function or api available to intercept addCookie ( ) so that the cookies set by the servlet will be encrypted using servlet filters.,0
1928,`users' table is located in newly created database.,0
1931,Check the CODE_FRAGMENT library in your project.,0
1942,If you see the source code of this method you will see that.,0
1948,This method is intended to just re-use the existing array and not allocate any memory.,0
1950,"The fact that the size constraint, and expansion is only related to CODE_FRAGMENT can also be a reason, not to add this behaviour to the method.",0
1951,That would just be extra code for the sake of just a particular CODE_FRAGMENT implementation.,0
1967,Here is what the content of FILE_NAME ended up looking like.,0
1970,What kind of a tool can I use to obfuscate/mask away my code similar to NewRelic `FILE_NAME?,0
1971,I want to display only the headers of public functions.,0
1983,JSTL will make the CODE_FRAGMENT tag available which can be used to iterate over you collection.,0
1985,I am working on Spring MVC project in which I need to pass an object from my Controller to JSP and then I need to iterate that object and show them in a table FILE_NAME page.,0
1986,Below is FILE_NAME which holds the data -.,0
1992,Do I need to use JSTL for this?,0
1993,Or there are any better approach for this?,0
1994,We have a Java web application served from Apache Tomcat 6.,0
1995,Our users are stored in a Windows 2008 R2 active directory.,0
1996,The application connects to the AD using COM4J from the API_NAME library version NUMBER.,0
2004,"Finally, we found the problem.",0
2005,It was caused by the scenario drawn at WEB_ADDRESS of Microsoft.,0
2013,I am looking to plot cluster heat maps from gene expression data that I have.,0
2018,I used Matthew Beckler's Java Heat Map a while ago.,0
2023,"Forgot ',' in Create Table Statements.",0
2036,Updated code.,0
2049,use an CODE_FRAGMENT and add a FILE_NAME if not in there already.,0
2054,Regex Explained.,0
2056,"CODE_FRAGMENT creates a capturing group, to be referenced later.",0
2067,Complexity is O ( N ).,0
2072,You may try like this.,0
2073,I try to split the String ``NUMBER ''to 2 new Strings.,0
2074,but I get a CODE_FRAGMENT.,0
2076,You need to escape dot.,0
2081,you have to use CODE_FRAGMENT.,0
2086,"So, I thought I could create FILE_NAME that counts and pass the stream through a API_NAME code is in this answer.",0
2088,So my Stream was finally.,0
2094,"The stream ( if non parallel ) could be pass sequentially through all the steps ( filter, map.",0
2097,Short answer.,0
2101,I suspect that's why the language designers made that decision.,0
2102,Why it technically does not work without CODE_FRAGMENT.,0
2105,"Every intermediate operation of CODE_FRAGMENT, such as CODE_FRAGMENT or CODE_FRAGMENT is actually just some kind of setter that initializes the stream's options.",0
2107,This is why CODE_FRAGMENT's argument is evaluated before a single item has gone through the first step of the stream.,0
2111,We want parallel treatment of our items.,0
2114,More detailed answer about why not allow it for non-parallel streams.,0
2121,I finally found my error!,0
2142,You almost certainly have a firewall or anti-virus program blocking your ability to connect.,0
2145,What can be the reason of this warnings?,0
2149,Someone saying here that.,0
2151,"Yes, i am using maven.",0
2152,Here is my API_NAME.,0
2155,Add this dependency to your API_NAME.,0
2159,Write to file.,0
2161,My logcat.,0
2164,Let's take a look at the CODE_FRAGMENT method.,0
2165,"CODE_FRAGMENT is thrown, because CODE_FRAGMENT is CODE_FRAGMENT.",0
2168,"If so, you should provide CODE_FRAGMENT by yourself at it's constructor.",0
2172,An CODE_FRAGMENT is.,0
2174,I have a Unix command to send email.,0
2178,Please guide me on this problem.,0
2185,Well... no.,0
2186,CODE_FRAGMENT against an object checks for reference equality.,0
2187,"That is, it checks to see if these two objects are literally the same spot in memory.",0
2190,It depends: which type of equality do you want?,0
2194,Maybe this way... Controller code for the CODE_FRAGMENT.,0
2195,CODE_FRAGMENT is an extension of CODE_FRAGMENT that adds a CODE_FRAGMENT status code.,0
2196,Used in CODE_FRAGMENT as well CODE_FRAGMENT methods.,0
2203,Where Object is FILE_NAME you want.,0
2204,I found work around from this post WEB_ADDRESS.,0
2206,First define an object to hold the entity coming back in the array.,0
2209,Then you can consume the service and get a strongly typed list via.,0
2217,Is there a best practices in using bower with a web application such that the application isn't bloated with unnecessary third-party library files?,0
2220,"From the articles I read, I kind of get the following.",0
2226,for which you can specify the target directory.,0
2228,"If we move forward with this, this is what I envision.",0
2229,If you're interested I have more to add ( since there's not a lot out there about this topic )... We are currently using maven ``js ''artifacts so we can leverage maven's dependency management with our 3rd party js.,0
2240,2 ) Create `bower_components' folder outside of your src folder.,0
2241,3 ) Edit API_NAME configuration file ( in the `bower_component's folder ) and specify path for each js library components.,0
2254,I have a native library that I call using JNI.,0
2260,A few notes.,0
2265,See NativeSystem.,0
2269,Its always fun when you have concurrent applications extracting different versions of your naive library to the same location and filename.,0
2270,Use API_NAME ( ) instead of API_NAME ( ) to load the extracted binaries.,0
2272,"Quite contrary, on Windows.",0
2284,"Check out the documentation for the CODE_FRAGMENT here, or.",0
2287,It will read a byte each time here.,0
2290,Quote taken from the CODE_FRAGMENT documentation.,0
2292,After that the UI thread CODE_FRAGMENT receives the message inside the CODE_FRAGMENT method.,0
2293,and acts accordingly to the message received and displays the message in your CODE_FRAGMENT of choice.,0
2295,On a sidenote.,0
2312,CODE_FRAGMENT Terminates the current line by writing the line separator string.,0
2315,This method behaves as though it invokes print ( String ) and then println ( ).,0
2322,"Note that the byte is written as given; to write a character that will be translated according to the platform's default character encoding, use the print ( char ) or println ( char ) methods.",0
2323,"Edit: - Missed to add one imp line, CODE_FRAGMENT.",0
2343,As to your point.,0
2349,The CODE_FRAGMENT will take care of the rest.,0
2353,That shouldn't be an issue though.,0
2363,"It is possible to pass VM flags to expand this range, too.",0
2365,Just changing the map's value externally does not reorder the priority queue.,0
2366,You will have to remove ( ) and add ( ) the Object whose ``score ''changed for it to move to its new position in the queue.,0
2380,And then for FILE_NAME we have.,0
2382,Examples of FILE_NAME names include.,0
2386,"Otherwise, the absolute name is of the following form.",0
2387,modified_package_name / name.,0
2397,Hope this helps anyone out there!,0
2403,"WEB_ADDRESS #setString% API_NAME,% API_NAME% 29.",0
2415,Example ( 35 degrees ): WEB_ADDRESS.,0
2418,I have modified your code to add them.,0
2421,Please refer to the code below.,0
2423,I am using the appcompat_v7 project as a library project in eclipse.,0
2425,And my Gradle File looks like this.,0
2430,where CODE_FRAGMENT is your CODE_FRAGMENT.,0
2432,"If you include the appcompat lib as you do above, you don't need to include support-v4 at all; appcompat depends on it, and the build system will do the right thing.",0
2433,So go ahead and remove FILE_NAME from your libs folder.,0
2435,I have chosen this as a recurring pattern throughout the project.,0
2437,InsertandRetriveBlobData.,0
2456,"Starting with the socket IO, since Java 7 the NIO API has been available, which means you can leave the threading required to prevent blocking the main thread to the OS.",0
2461,"You might also want to look at an API like Netty, which I believe saves you from having to write logic to re-construct messages.",0
2463,"Once you have a complete message, you need to process it.",0
2470,"Each node in the network sends periodically updated data from sensors ( voltage, current, temperature etc. ).",0
2471,I start a new Thread for handling each remote object.,0
2475,Maybe try put your data into BlockingQueue and in main thread take data.,0
2477,this is FILE_NAME to read your data from BlockingQueue.,0
2480,So i created this from scratch.,0
2482,and of course API_NAME.,0
2490,it will tell from where to pickup the root-API_NAME.,0
2493,What am I missing???,0
2495,"However, you can find the documentation in the OpenJDK source itself.",0
2497,It's documentation can be found here.,0
2506,"a way to get FILE_NAME type, thread group or maybe just the priority of the interrupting.",0
2519,In a word: No.,0
2522,What happens if a thread is interrupted multiple times by different threads?,0
2523,Which one should be reported?,0
2526,You probably to build your own event mechanism in which the events carry the information you need with them.,0
2531,"Using this, i am able to generate an encrypted text but the PHP server is not able to decrypt my encrypted text.",0
2536,Some other pointer.,0
2538,I am using API_NAME for encoding.,0
2540,Working Python Code.,0
2541,I'm looking for a well-maintained Java bytecode manipulation library with an intuitive API.,0
2556,Take a look at this article.,0
2579,"Maybe you could do the same that he did, i.e. explicitly declare rc05 version of Guava to force maven to use this one?",0
2580,( see: this answer ).,0
2583,how do i map FILE_NAME to set the values and create a different json with the same format?,0
2602,There is no exact equivalent of a CODE_FRAGMENT in JDBC.,0
2604,I am specifically referring to InputStream ( Java SE ) and its implementations.,0
2605,How is blocking performed?,0
2608,"No, they don't use busy-waiting.",0
2609,"It's up to the implementation ( which will depend on the kind of input stream you're using ), but generally it's likely to use a blocking OS-level API, so the efficiency will depend on the OS.",0
2611,the exception is on line 72 and 114.,0
2613,Please not that in the above code CODE_FRAGMENT method will close not only the CODE_FRAGMENT object itself but also its underlining stream ( i.e. keyboard input ).,0
2628,"This means you've picked up a version built against Hadoop 1.x, hence the FILE_NAME vs interface exception.",0
2635,One which is the Pro full API.,0
2637,I see some mention of ``flavours ''on the net but seems all the hits are to do with Android development and properties.,0
2641,"When you build, you can publish the binaries for both pro and lite to your artifact repository ( nexus, artifactory, etc ), and then you would have 2 separate jars.",0
2643,A single Gradle project can produce any number of JARs.,0
2644,You could simply add another Jar task and give it a unique classifier to distinguish it from the ``standard ''library.,0
2645,Say I have a input field which will only accept a CODE_FRAGMENT when the submit button is pressed.,0
2650,"You'll need to customize the formatter's CODE_FRAGMENT method, since NumberFormat normally ignores trailing characters.",0
2661,"What I would like to do, take any random XML, and create object which will contain timestamps, integers, strings as well maps, basically it would be all decomposed based on the XML structure.",0
2665,Is there better way than to do it manually?,0
2683,Component scan configuration file.,0
2689,"In a FILE_NAME code base in my recent job, I see the below code.",0
2691,Are there examples you have that could shed light on the above MapHelper's usefulness?,0
2695,you could use.,0
2700,See also `Is there a Java equivalent or methodology for the typedef keyword in C++? ',0
2703,They appear to have foresight about what the Map contains.,0
2710,There are some examples like this in the Java API such as.,0
2722,Does anyone know what the C# equivalents would be for the methods shown above?,0
2724,"XmlWriter, forward-only xml stream generator.",0
2730,The API_NAME file code is.,0
