id,text,oracle
6,But sadly this is not working.,-1
78,"So, everything builds fine, but when we try to deploy the application to GFNUMBER we get the FILE_NAME file not found ''error.",-1
90,That is what is causing your null pointer exception.,-1
139,"All attempts I've made were, in a shortcut, unsuccessful.",-1
162,Don't use.,-1
187,"However when I try to run FILE_NAME, it gives ``The system cant find the path specified error ''for the batch file.",-1
200,"Problem: without zooming, the added content doesn't get visible.",-1
201,"in a application you can workaround with scaling the window size, but in an applet I wasn't able to solve that problem.",-1
256,else your GUI will be Hanged.,-1
342,I am not sure about Map implementation in HazelCast.,-1
361,But the above code doesn't work outside the ``FILE_NAME JavaAgent`` FILE_NAME of the main Agent.,-1
436,"Please note there is a bug in FILE_NAME, L996 +997.",-1
444,I am not sure why I can not get it to work and have been struggling with it for a while.,-1
448,the problem is the following.,-1
491,"When I run my client, it throws the following exception.",-1
521,i did come across the same issue with Java API_NAME works in JDKNUMBER.,-1
526,I am unsure how to return an array that will avoid returning CODE_FRAGMENT as an element of that array.,-1
580,This is the first time I've encountered something like below.,-1
583,NOT WORKING: directly compiled the src on Unix machine and used FILE_NAME files.,-1
587,"For some mystic reason, the workflow is not enetering if ( )... Same exact code runs perfectly if I directly paste FILE_NAME files from Eclipse's bin folder.",-1
617,It might not reproduce consistently but at one point you might see the issue again.,-1
619,Still that does not guarantee that the first thread will run and only then the second one will check if the size > 0.,-1
653,Eclipse error: `Failed to create the Java Virtual Machine '.,-1
726,But unfortunately it can not be used!!!,-1
832,Maybe there are some problems with the path of the file ( on my pc )!?!?,-1
855,... but no such thing exists.,-1
892,"After entering the details, when the button is clicked, the entered data must be displayed as shown below, but I am not sure how to align it.",-1
940,But the file output messes with the chinese characters.,-1
964,Not related.,-1
965,Not even sure what JSR that is.,-1
994,I had the same issue using a remote postgres instance.,-1
1027,I would avoid to generate the full XML String ( see @AdriaanKoster 'response ).,-1
1079,"I wanted to see all the files I have in my external storage, I have this library that display the text to the user, but when I'm using it to show the sub files, it says something like.",-1
1152,"A workaround might be to use reflection, however this isn't a generally recommended approach for a number of reasons ( brittleness, performance problems, breaking encapsulation, etc ).",-1
1223,That can hide an error and keep you searching for dogs a whole week while the problem was really a cat ( ch ).,-1
1230,"AS I know, it's impossible in the case.",-1
1244,It is not advisable to avoid an exception with an empty catch block even though you are completely sure that is not going to fail under any circumstance.,-1
1255,"You are really asking too much of the Java runtime ( and Jackson library ), by trying to make them infer all the required information about the type to be instantiated ( based on the parameterized return ).",-1
1261,Server not starting in Eclipse Gallileo IDE with WAS7.,-1
1336,Your API_NAME is messed up and doesn't list dependencies properly.,-1
1388,Without that information you have to start the debugging process by guessing.,-1
1424,so I'm not happy with it.,-1
1455,"Connections, on the other hand, are expensive and need to be managed carefully by the application.",-1
1504,i try to return an output ( type date ) in a web service but i receive a weird result.,-1
1566,"My previous code example used CODE_FRAGMENT to fuse the filter and map operations, but this was cumbersome and provided no advantage.",-1
1613,At the moment I am receiving a ClassNotFoundException to API_NAME.,-1
1617,"I added it into my ANT_HOME / lib directory, but it didn't have any effect.",-1
1622,"It didn't make any difference, I receive the same error.",-1
1663,An SQL EXCEPTION is being caught saying API_NAME: [ Microsoft ] [ ODBC Driver Manager ] Data source name not found and no default driver specified ''.,-1
1763,"If you've created your File IO and pulled from it in a weird way, you can corrupt the encoding of the key material.",-1
1791,But the exception is occurring.,-1
1797,i'm having a difficult time figuring out to properly sort arraylists FILE_NAME though.,-1
1812,I don't have any code to show because I don't know where to start.,-1
1921,I am not able to find any documentation or info.,-1
2008,I tried to download API_NAME file but I am not getting the file on net.,-1
2009,I found API_NAME but that is for Ubuntu and not for Windows.,-1
2010,I find this error when I am trying to open this file.,-1
2022,There are many errors in this code.,-1
2026,Used wrong column names which does not exist in the table.,-1
2041,It's ugly and inefficient but it should work.,-1
2120,"Anyway, their current behavior does not allow what you want.",-1
2127,"It seems, that there must be some problem when genereting the response.",-1
2128,"I can successfully call my service but when generating the response, it seems to crash.",-1
2130,But as far as I create the entitymanager - which not necessary has anything to do with the response - it crashes... ( I still respond with just 200 ).,-1
2150,"The following warning messages should be ignored, they are `false-positive 'alert messages.",-1
2244,"Since this afternoon, it have started to give an error and the process ends, leaving to process thousands of files.",-1
2259,"Its a little complicated, there is a full example in this loadNativeLibrary ( ) method.",-1
2278,Here is an example I don't understand.,-1
2298,"Bear in mind, that the above code might not compile ( I haven't tried it out myself... ).",-1
2399,Not sure why but I am getting following error from my FILE_NAME.,-1
2468,The important different between these two approaches is that with the multi-threaded example there's no guarantee of processing order.,-1
2479,since a day I have a very annoying problem - I can't run any Spring MVC application: / Today I have tried to write something basing at Spring Documentation.,-1
2533,Any idea what i might be doing wrong.,-1
2575,I think that you have a problem described in this bug report.,-1
2578,Someone on StackOverflow had similar problem.,-1
2584,i am trying with Jackson but im getting no suitable output.,-1
2606,"I'm a little worried that they use a ``busy-waiting ''mechanism, as it would produce a lot of overhead.",-1
2656,"I don't want to get the last token and reuse it for the next query, it does not make a sense since I want to use batch.",-1
2705,Less margin for error.,-1
2745,Wrong CODE_FRAGMENT CODE_FRAGMENT attribute.,-1
2796,I was unable to get a perfect match.,-1
2824,I am not able to deploy my App Engine project locally.,-1
2841,You absolutly need to be compiling FILE_NAME JRE NUMBER!,-1
2862,"There is, of course, an API for the DRL compiler's parser, but it isn't stable and as complex as DRL rule syntax, which is considerable.",-1
2872,I'm having trouble figuring out how to do this in drools 6 +.,-1
2899,But this refernce doesn't solve my problem.,-1
2928,"This is an absurd, unreasonable and frankly ridiculous requirement; I can't imagine what use such a data structure would be good for.",-1
2938,First of all I do not think you need all these.,-1
2958,"This means, it was not possible to resolve the dependencies of the API_NAME to the API_NAME.",-1
2965,"But now I think the problem is, JNA creats temp files for the native librarys wit ``jna ''prefix and a unique generated numeric value.",-1
2971,then I gets the module error again from JNA.,-1
2999,This line gives the error.,-1
3024,"I am using standout library, I added a videoView in it, Everything is running correctly, Except if i click on video then mediaController Is not Showing and i am getting null pointer exception.",-1
3132,And an CODE_FRAGMENT argument type can never accept a CODE_FRAGMENT.,-1
3134,But the underlying hard distinction between primitive and reference types remains.,-1
3172,You have problem with classpath.,-1
3186,Only the LoginHandler fails to compile.,-1
3214,I can not read correctly a CODE_FRAGMENT and i have charset problem.,-1
3244,If I give the 2 input given below it is showing an error.,-1
3287,does not work without previously setting the FILE_NAME.,-1
3366,They all fail with the following error.,-1
3382,The following is the error I keep getting.,-1
3396,But it isn't working like I expected.,-1
3398,"But unexpectedly, I am getting 66.",-1
3430,"As an aside, configuring the CODE_FRAGMENT that is created by the CODE_FRAGMENT is not supported.",-1
3569,Why is it reading it wrongly?,-1
3622,The error is as shown below.,-1
3623,Exception in thread ``main`` API_NAME: Uncompilable source code - Erroneous tree type.,-1
3639,I don't know if it is possible to show timer on cards.,-1
3679,The problem is that when reader contains CODE_FRAGMENT it is not reporting ready.,-1
3681,I tried the following and it returns nothing.,-1
3798,I searched a lot but i not found any solution.,-1
3842,"What I don't understand is -- if one thread is still stuck, deadlocked, inside CODE_FRAGMENT, then how come all the other threads were able to get past the CODE_FRAGMENT call?",-1
3848,"When I tried to compile the tool, I get n error.",-1
3853,I don't know what else to do to make things to work.,-1
3897,I think the actual CODE_FRAGMENT would be a little more complicated to simplify.,-1
3927,"I have created a custom MenuBar in my Processing sketch ( using Eclipse as my IDE ), but it is not displaying.",-1
3935,"I expected there to be a CODE_FRAGMENT Menu in the CODE_FRAGMENT, but there is none.",-1
3965,but still nothing.,-1
4040,But it's not necessary for our case.,-1
4079,Java JTextPane JScrollPane Display Issue.,-1
4109,I suspect there may not be a good solution for this right now.,-1
4141,I thought that the problem was the ``id = null ''.,-1
4149,"I haven't used EclipseLink myself, so all I can do is guess, but what surprises me is that FILE_NAME doesn't have a setter for the id property.",-1
4167,"I learned that such beans are proxied using CGLib, but still can not figure out how proxy can handle thread.",-1
4275,This is your problem.,-1
4295,This is not my intention.,-1
4333,I guess my approach is wrong so I'd appreciate some guidance.,-1
4551,This isn't valid Java.,-1
4578,"Well, the funny part is, we do not know.",-1
4596,The data structure you are saving your data is not very optimal for the days with daylight saving time.,-1
4636,This is part of the code which was working fine and now it's not.,-1
4637,The exception is throw on CODE_FRAGMENT.,-1
4645,I've notice that some of the feeds had false value.,-1
4698,The problem is that you wrote.,-1
4775,I wrote this code to update a patient in a derby database but it throws a CODE_FRAGMENT.,-1
4812,"I understand why you tried CODE_FRAGMENT, but with the fix above we no longer need that, we can just declare it CODE_FRAGMENT.",-1
4813,Your CODE_FRAGMENT method calls itself recursively leading to an infinite recursion.,-1
4841,CGLIB proxy did not work for my case.,-1
4861,Problems creating JAXBContext to marshal object as XML.,-1
4869,I'm about to hang myself with the little rope I have left.,-1
4940,Here is a demo for the naive implementation which doesn't work.,-1
4942,Because it's not initialized yet.,-1
4945,( So the problem is CODE_FRAGMENT ).,-1
4947,"I need all subclasses to execute CODE_FRAGMENT, but I can't rely on them doing it explicitly.",-1
5101,"Since this is correct, why byte code noting down the return type of the called method, and raising error when the library is updated with a return type for the method.",-1
5128,Data loss.,-1
5219,"When I run the project, I get the following error,.",-1
5256,"As you can see, the translucent text is clearly standard AA and rather than a clean translucent rendering, it has that awful '90s ``spidery ''appearance.",-1
5307,"As others have stated, this is not an issue with JPA/hibernate but rather with the json serialization library you are using.",-1
5310,We ran into the same sort of problem with Flex and JPA/Hibernate.,-1
5364,"All seems OK, but I get a NullPointerException ( NPE ).",-1
5385,... Which brings me to the only downside I found: it might take a little while to wrap your head around TrueZIP.,-1
5409,I am trying to link my native library to FILE_NAME application but when I try to run it I get a CODE_FRAGMENT exception complaining about missing symbols ( CODE_FRAGMENT ).,-1
5478,"( When I say don't use floats that includes doubles, it's the same issue. )",-1
5542,It's not possible using the Selenium WebDriver API.,-1
5567,I have read the Doc but i am not clear what is meant by CODE_FRAGMENT.,-1
5607,"Annotations like CODE_FRAGMENT and CODE_FRAGMENT will not work, unless you process them yourself and invoke the appropriate methods.",-1
5623,There is a caveat with the above approach.,-1
5636,"It says that you dont export the JUnit Library into the build, and if the build relies on the functionality of that lib, there might occur CNF-Exceptions.",-1
5649,"If I run the code in the GUI, it just hangs.",-1
5655,I have looked and found that there are some packages that would automatically enter my keyring on login but that isn't really an option.,-1
5670,"When I first saw it, I was horrified.",-1
5718,"Drawback of above approach not using copy of data is that thread safety is harder to achieve, though.",-1
5791,This code failed.,-1
5803,"You can not supply system properties to the API_NAME tool, unfortunately.",-1
5812,I have found out that certain misconfigured servers send an ``Unrecognized Name ''warning in the SSL handshake which is ignored by most clients... except for Java.,-1
5878,You can't open CODE_FRAGMENT with CODE_FRAGMENT.,-1
5887,This is an issue with how volley handles HTTPUrlConnection and retry policy.,-1
5964,So it's basically in the wrong form.,-1
5996,Avoid them.,-1
6114,This may or may not work.,-1
6309,On Facebook i ran in to a problem.,-1
6316,The result was the same that i don't have the correct permissions.,-1
6326,I am new to this so maybe i'm doing somthing wrong.,-1
6329,And now my app is getting it's app Token and i can use it to publish messages but the problem is those messages can not be viewed on the app page it self.,-1
6378,"There's no way to do that, AFAIK.",-1
6385,You can't suspend a thread like that.,-1
4,Perfect would be to have in my CODE_FRAGMENT.,0
5,and then override this with CODE_FRAGMENT so that I could do.,0
9,Define your production environment as default profile in your API_NAME.,0
11,You can setup your API_NAME as filtered resource and have this value filled by maven from maven profile settings - that what we do.,0
15,Now you can use.,0
20,About setting default production profile already posted @andih.,0
25,So I do the following.,0
39,Many thanks.,0
40,Use this construct.,0
44,According to docs.,0
57,the way this projects i associated is.,0
89,"In your FILE_NAME, CODE_FRAGMENT has not been set and therefore is CODE_FRAGMENT.",0
98,"I am trying to use JNDI for the JDBC connectivity, but it returns NULL DataSource.",0
105,and hear is the code to connect.,0
112,Thanks for any help with this.,0
119,"Also, what's the difference between wait() and await() from CountDownLatch?",0
121,EDIT: I guess I need to rephrase my queries.,0
122,Await( ) as per the docs says.,0
131,With a CODE_FRAGMENT you can easily wait for all of the tasks to be completed.,0
134,Looking up the documentation is step one of any question.,0
136,CODE_FRAGMENT is an actual function of CODE_FRAGMENT whereas CODE_FRAGMENT is inherited from CODE_FRAGMENT.,0
140,What I am trying to do.,0
145,"Well I thought I am authorized, once I used my API_KEY to authorize my access to GoogleBook.",0
146,I did this like this.,0
153,Thanks.,0
156,You should declare CODE_FRAGMENT as CODE_FRAGMENT.,0
166,I can draw the circle with a transparent background like this.,0
179,I am executing a batch file FILE_NAME program.,0
181,I kept the batch file as a resource in the source directory.,0
183,resources/API _ NAME creation option: package required library into FILE_NAME ).,0
191,"While Java can read JARs and treat them just as the normal file system, most other applications can not.",0
196,Inside FILE_NAME that should trigger the batch file put the following.,0
204,"actually, it looks smth like this.",0
209,So try.,0
217,I am developing some small stuff for google app engine FILE_NAME.,0
223,That means you need to use the Google FILE_NAME files.,0
227,"because this API depends on which server ( tomcat, jetty ) you are using.",0
228,so it comes with the server.,0
232,Below are the features of Intellij IDEA ultimate edition.,0
238,Hope this helps.,0
239,I'm using Apache ftpserver ( Java ).,0
240,I need to have a nofication in my program when a file is uploaded through the ftp.,0
242,Any solutions out there?,0
244,"I am assuming that, you have a desktop program, which is running on the ftpserver itself.",0
248,Lets see....,0
259,You can get all notifications using ftplet.,0
264,While there are modules that need a Spring context since they just wrap parts of the domain model we think that some of our APIs do not.,0
266,There is a central interface to access this API.,0
268,So a simple initialization would be.,0
272,It should mean either of the following two.,0
276,"Or, assuming that CODE_FRAGMENT is a specific implementation of the CODE_FRAGMENT and AInterface is the central access we could just say, A uses a certain implementation of BInterface by default and so on and actually set them internally with new.",0
281,"So we're wondering how do other API developers make their interfaces and beans accessible without relying on a context import ( which btw also clutters up the target context with many potentially unneeded beans, like for example if an API provides several services and I only want to use one )?",0
293,But is there a way to have Netbeans automatically connect with API_NAME and retrieve these files?,0
298,Unless you start using Maven or a similar dependency management tool.,0
304,"The name CODE_FRAGMENT is a package name, and we only use the name of the site as a convention.",0
331,I have already created a custom access decision voter and using it in a custom access decision manager.,0
334,Can i use the Object o parameter specified in the vote interface method?,0
348,Your EntryListener will be called by Hazelcast's internal threads.,0
352,This can be done by submitting a runnable to an ExecutorService maintained by you.,0
355,I've attached a font (.,0
357,This library is attached to a Java Agent.,0
358,In that agent I can get an inputstream on the font file using this code.,0
369,"Then, I changed the client to use jQuery file upload.",0
371,in order to have a more powerful client ( with drag and drop ).,0
393,due to which spring dependency injection was working fine and was getting a bean through.,0
394,"But now, I have also integrated PowerMock in it.",0
398,You have to use the PowerMockRule.,0
402,and you should get the following test results.,0
405,"With this annotation, you don't need the PowerMock rule anymore!",0
406,I added CODE_FRAGMENT to my Java Build Path.,0
408,How could I add FILE_NAME files into the CODE_FRAGMENT file??,0
412,First declare it like this.,0
418,"For example: if I have an excel sheet populated, I can change the value of certain cells while leaving the value of others?",0
419,Thank you in advance.,0
420,"Yes, you can do it nicely using Andy Khan's JExcel library.",0
425,"In order to improve performance, data which relates to output information ( eg.",0
435,"You'll have to write some utility to do this, however it is possible to do in JXL.",0
445,Any help would be appreciated.,0
446,Here are my classes.,0
457,You use the simple array with the fix size 5.,0
458,"It means, that if you add more than 5 hobbies, it will throw CODE_FRAGMENT.",0
460,"The arrays are initialized to CODE_FRAGMENT by default, which means, that if you set less than 5 hobbies, you try to call it on CODE_FRAGMENT which throws CODE_FRAGMENT.",0
464,So my question now is.,0
467,Any help here?,0
473,You will have to come up with a different approach if you expect to make it configurable after deployment.,0
490,And I'm using the following block of code to invoke the service.,0
493,"As the error says,.",0
494,So you must change the signature of your method to.,0
497,You can not return any thing.,0
506,It should be solved FILE_NAME 8....,0
523,Delete with a payload works fine in Jersey clients 2.x.x.,0
527,"I.e. if there are 4 students in the initial array, but only 2 are failing, my array is returning: student1, student2, null, null.",0
528,My current result when I do a test run in main is.,0
529,"You're creating an array that is as long as the original array passed in ( which fills all elements with null ), but not necessarily filling all the slots.",0
551,By default CODE_FRAGMENT sets all parameters on the value stack.,0
554,this is one of the mechanism provides by Struts2 to handle Cross-Site Request Forgery ( CSRF ).,0
555,Have a look at.,0
559,"Say the fruits are, apples, oranges, mangoes,... etc., If the user selects apples, I call apples ( ), if he selects mangoes, I call mangoes ( ) and so on... To select which function is to be called, I Don'T want to use a switch or if-else statements.",0
560,How do I select which function is to be called during run-time?,0
561,NOTE: The programming language I am using is Java.,0
563,Use CODE_FRAGMENT.,0
577,Try using equalsIgnoreCase instead of straight CODE_FRAGMENT.,0
581,Multiple Threads ( Inner classes implementing Runnable ) sharing a Data Structure ( instance variable of the FILE_NAME ).,0
582,"Working: took classes from Eclipse project's bin folder, ran on a Unix machine.",0
588,I apologize if I missed anything obvious.,0
589,Thanks a lot @maasg... Solution was to add synchronized ( myArrayList ) before I check the size in the Thread 2.,0
590,"To access a shared structure in a multi-threaded environment, you should use implicit or explicit locking to ensure safe publication and access among threads.",0
591,"Using the code above, it should look like this.",0
595,Using a concurrent data structure lets you get rid of the synchronized block.,0
596,Check the return of.,0
600,You could also use.,0
601,to ensure the arraylist is always synchronised correctly.,0
607,If I got this right.,0
620,"Depending on what you need to accomplish, there might be better / other ways to achieve that.",0
623,"Based on the stacktrace, your output directory is not empty.",0
634,A FILE_NAME name should be used.,0
641,In my main method im parsing the command line arguments like this.,0
642,If I'm now running my programm with the following command.,0
644,Why does it treat this as my output directory?,0
645,I specified another directory as the output directory.,0
648,This should read all files in the single input directory.,0
650,It gives me the `Failed to Create the Java Virtual Machine '.,0
658,Every file has same data which is saved into Employee Table.,0
663,Another option may be the Factory pattern.,0
665,Of course you can combine both.,0
672,You could use a kind of strategy.,0
681,"This way, you can create new readers for any filetype dynamically.",0
685,Hope it helps.,0
689,You would only need parsers and a successor to each parser.,0
691,"In some cases there is a trade that you need to do, thus you should take into account your project's requirements.",0
698,Tried just to see the response.,0
706,I am trying to use EqualsBuilder in the apache commons library.,0
713,I have downloaded a few Android applications from Google Play.,0
714,I have got CODE_FRAGMENT code through reverse engineering tool CODE_FRAGMENT.,0
717,Is there any way to generate call graphs automatically?,0
727,"thus I tried to write my own tool using Ruby, which can be found in here.",0
731,and with WSAddressingFeature enabled.,0
734,Do you have any hints to avoid this error?,0
739,Thank you!,0
740,Gotcha!,0
744,The full story here!,0
764,So if you annotate FILE_NAME only with CODE_FRAGMENT it will not get exported.,0
778,I am trying to figure out how I could make something that looks like a folder file structure for a Java shell I am trying to make.,0
779,I want it to resemble something like the linux folder structure ( having a root and all decending from it ).,0
784,The folders in the tree would be ``server ''objects ( a FILE_NAME ) created by the root ( the FILE_NAME ) which in turn have`` application'' objects ( FILE_NAME ) created by a method in the server object.,0
794,In pre java7 simulating an ``in-memory filesystem ''is fairly complex.,0
810,Find out more.,0
816,How should I encode these 2 parameters to be consistent with what w3schools says is correct ( or is w3schools wrong? ),0
819,"Java's CODE_FRAGMENT complies to this RFC, with a few caveats mentioned in its Javadoc.",0
822,Trust URI.,0
833,"CODE_FRAGMENT type of inputs are not simple attributes, they are sent in separate chunk of the request.",0
838,Java library for reading multipart/form-data http body containing multiple files.,0
841,Use FileUtils from Apache commons.,0
842,"Using you current code, make this tweak.",0
849,You may use the Eclipse's AST parser also in combination.,0
