id,text,oracle
4588,When I sum 3 hours to my midnight I get 04:00:00!,0
4590,Where is my mistake?,0
4600,I recommend that you change the way you store your day and use a date.,0
4602,You might do something like this.,0
4613,Omitted time zone.,0
4615,Should have been translated to UTC time.,0
4619,Like this: CODE_FRAGMENT.,0
4620,No Midnight.,0
4624,Some comments about this source code.,0
4626,Note that the time zone ( for Rome ) is specified.,0
4647,EAR dependencies.,0
4648,"The datasource should load from jndi, this is my API_NAME.",0
4653,And I've added these settings to the WebMvc FILE_NAME.,0
4659,i am making application that have scroll listener that add data from multiple URL.,0
4666,You are setting adapter eveytime after executing doInBackground.,0
4671,I want to ask some questions.,0
4677,"( My question is here, how to list the music on JScrollPane?? )",0
4679,"If i double click each music ( sample1, sample2 ), the music that I choose is playing.",0
4682,I want the music's name that I choose.,0
4684,"like sample1, sample2 so I can play the music like FILE_PATH format is FILE_PATH how to get that music name?? )",0
4689,I want to use JSONArray FILE_NAME.,0
4699,But you should have written.,0
4700,"I'm FILE_NAME NUMBER on Tomcat 7,.",0
4701,I can send POST request with this code.,0
4713,Use copyOfRange method API_NAME.,0
4714,"startIndex is the initial index of the range to be copied, inclusive.",0
4717,To get negative values working as well you could make a helper method for this.,0
4726,Doesn't a for loop work exactly like the slice operator in python.,0
4727,This is a list in python.,0
4728,This is how the slice operator would work.,0
4746,OutputRaw solve me issue.,0
4747,I have page FILE_NAME / tml ).,0
4749,"Page contain also other components: grid, textarea and etc..",0
4752,"So variable contain CODE_FRAGMENT, CODE_FRAGMENT, CODE_FRAGMENT.",0
4761,The output that I get is -.,0
4770,The statement should have been.,0
4779,Here is what I have now.,0
4780,Edit: Thank you everyone for the help!,0
4783,ASCII codes... Characters are understood as integers in the above code ( e.g. CODE_FRAGMENT is 65 ).,0
4788,"That said, you have a couple options.",0
4789,You could write a Matcher that only accepts alphabetic characters.,0
4793,This would look like.,0
4795,I am using batik library to create pdf document from svg file.,0
4796,Single page export is limitation of this library used to export PDFs and currently page size is simply increased to accommodate more data.,0
4814,Just delete the method.,0
4815,CODE_FRAGMENTs have default CODE_FRAGMENT methods that do as you expect.,0
4817,Just delete the instance variable CODE_FRAGMENT.,0
4823,Choose an appropriate locale ( or leave out the two locale arguments to use the computer's defaut ).,0
4826,"I cant use Date format,, only string.",0
4835,Spring AOP provides an option on proxy via FILE_NAME @EnableAspectJAutoProxy ( proxyTargetClass = true ).,0
4842,But I used AspectJ loadtime weaving.,0
4843,More details in thread.,0
4848,"In my case, I simply excluded the jaxb-impl that came with camel-jaxb and the application started working correctly.",0
4859,The FILE_NAME ( NUMBER ) is coming from camel-jaxb in my app so it seems very contained and not like this answer suggests.,0
4863,Netbeans with JAXB Random ClassCastException.,0
4865,can not be cast to API_NAME.,0
4873,The final CODE_FRAGMENT should look like.,0
4874,---------------------------- ^ should be replaced with CODE_FRAGMENT and appended to the whole string.,0
4875,"I've read a bit and tried out some of the libraries which were pointed out here, such as Velocity and FreeMarker.",0
4883,The only thing to take in account is that templates must be staticly generated ( in order to be processed at compile-time ).,0
4885,"I have 2D closed vector paths, specified in SVG paths-like syntax - i.e. these paths include straight lines and various Bezier curves.",0
4905,"I expect to do a system when you can do a survey, and then, press a button, open a new activity and see survey answers.",0
4908,"Here is my code of the survey, XML and JAVA.",0
4913,"like this just capture all user input data, No need for the database in this.",0
4914,Here list is the list of all question you are having....,0
4916,getQuestion and similarly with answer.,0
4918,I have a CODE_FRAGMENT starting alongside with app.,0
4924,"In this situation, when I click on the greyed out widget, I need to start the app.",0
4926,how I could achieve this.,0
4930,You may want to check CODE_FRAGMENT.,0
4948,"Your showFields method needs to traverse FILE_NAME hierarchy, something like this.",0
4949,"Note that I used CODE_FRAGMENT, not CODE_FRAGMENT, because the latter only processes public fields.",0
4953,Let's assume my model looks like this.,0
4957,"I'm using CODE_FRAGMENT with a jackson and I was wondering if there is any better way to build a list of building an expanded version of this list than first calling then list method and then foreaching over all the Ids, calling the detail resources and appending the result to a list.",0
4961,Unlikely - Redis' PubSub messages are Strings/Byte streams.,0
4966,Plese guide.,0
4967,"Input SAD_FACETotalDigits Required, NaturalNumberToBeFormatted ).",0
4968,Targetting to achieve.,0
4969,"You can use CODE_FRAGMENT with a dynamically created format string, e.g. input CODE_FRAGMENT should become CODE_FRAGMENT.",0
4970,"If you prefer using a CODE_FRAGMENT, you can call CODE_FRAGMENT to get the desired result.",0
4984,New information shows that a partial cross-join of the data is desired.,0
4990,Store them in memory in a CODE_FRAGMENT.,0
4996,Optionally replacing the CODE_FRAGMENT with the actual processing logic.,0
5003,"Thread 2 iterates CODE_FRAGMENT and finds matching records by calling CODE_FRAGMENT, iterating the submap, giving matching CODE_FRAGMENT and CODE_FRAGMENT records to thread 3 for processing.",0
5016,Hmmm.,0
5027,But shouldn't it be (... | | fromIndex > = toIndex )?,0
5030,"So you can see, since CODE_FRAGMENT, exception is not thrown.",0
5034,Can you help in understanding this code.,0
5035,Looks like it is getting timezone As an off-set from GMT in hours.,0
5056,"In the code you referenced, readLine is called on a BufferedReader.",0
5061,An InputStream or a Reader is where you read your input from.,0
5063,The CODE_FRAGMENT / CODE_FRAGMENT classes and subclasses are for reading / writing character-based data.,0
5071,"In your particular example, the code is asymmetric because the HTTP service it designed to talk to is asymmetric.",0
5078,Here's an example of a JSON structure.,0
5079,Here it's the function that parses the json.,0
5082,"I've a JSON structure which is fully dynamic, I don't always know what structure will come from it.",0
5087,Can I use a recursive function?,0
5093,Here's a question about what's the difference between them: Gson Type Adapter vs. Custom Deseralizer.,0
5113,Consider the following interface.,0
5114,"Due to type erasure, it will have a method CODE_FRAGMENT on the byte code level.",0
5115,Now consider the following FILE_NAME.,0
5122,Avoid legacy date-time classes.,0
5129,The CODE_FRAGMENT has a resolution up to nanoseconds.,0
5133,"Instead, use API_NAME classes.",0
5135,"When you get your CODE_FRAGMENT, immediately convert to API_NAME types.",0
5137,"In the ThreeTen-Backport library for Java 6 & 7, use CODE_FRAGMENT.",0
5138,An CODE_FRAGMENT is a moment on the timeline in UTC with a resolution of nanoseconds.,0
5141,API_NAME framework is built into Java 8 and later.,0
5144,"To learn more, see the Oracle Tutorial.",0
5146,Specification is JSR 310.,0
5161,Can anyone told me how to compare this two in best practice?,0
5165,Use it.,0
5168,You probably mean.,0
5172,e.g. see WEB_ADDRESS.,0
5173,I am using a regex that would basically regex for the following URL.,0
5174,The regex is.,0
5176,I am using this.,0
5184,You can use this regex.,0
5185,You are missing CODE_FRAGMENT for that your patter not match because it contain more than one character or number.,0
5196,"If so, please show an example.",0
5203,What is best practice while testing Android Services?,0
5208,"After configure FILE_NAME to handle the payment process, following the instructions from here, I run my application and try checkout an order with paypal.",0
5218,"I have this CODE_FRAGMENT file provided below,.",0
5220,"I took several measures,.",0
5223,What should I do to solve the issue?,0
5225,I want to check those http request/response pairs against mod-security rules for auditing-purposes.,0
5233,How can I detect a USB device plug in and out ( kind of listening ) with Java?,0
5257,"Is this due to a technical limitation for sub-pixel AA in general, or a bug in Java, or just because Java doesn't even try for translucent text, or have I missed something?",0
5258,Graphics Initialization.,0
5260,I think its because your using GASP which takes the points from the font style.,0
5267,See here.,0
5275,url: WEB_ADDRESS.,0
5284,I've given an example below.,0
5293,There are several options.,0
5295,Otherwise you can enable eager fetching for particular query.,0
5317,Since that time we've tended more toward option two.,0
5322,I will post it here if I find anything new.,0
5325,But I want to connect this mobile application to the IIS server.,0
5333,you can create webservice and deploy it over IIS and consume it from j2me app /.,0
5339,and the callback expected takes a parameter of a record.,0
5342,There are one caveat with the use of callbacks in JNA.,0
5344,This is especially true for long lived callbacks.,0
5347,"Otherwise, it is important to have the callback instance deregister itself in it's finalize method.",0
5359,Here is the code that does the push.,0
5365,Here is the Tomcat 6 LOG ( it sends to subscriberID '99' ).,0
5370,"For the records, I found it ;o).",0
5372,For deails see Adobe forums thread.,0
5374,Enjoy and thank you for your time!,0
5378,FILE_NAME files are either bz2 or gz.,0
5392,Or simply use Maven repository.,0
5394,Select the JRE that is used for your projects and hit edit.,0
5395,Add other jars from your JDK.,0
5397,All projects will see the changed JRE definition.,0
5437,See details of this method here: WEB_ADDRESS #API_NAME.,0
5438,( And please reformat your code ).,0
5446,The customer is sleeping while he gets his massage.,0
5448,The customer leaves the salon.,0
5450,If there aren't any the masseur goes to bed again.,0
5454,I have FILE_NAME MassageSalon.,0
5463,You could use a fair Semaphore called NotSleeping.,0
5464,"As long as the customer does not enter the saloon, it holds NotSleeping.",0
5480,Here's an example.,0
5484,In both cases the BigDecimal shows me what the number is that it holds.,0
5489,Use FILE_NAME instead of float.,0
5490,And use Java code like this.,0
5491,"I wouldn't use CODE_FRAGMENT, I suggest using CODE_FRAGMENT or CODE_FRAGMENT or CODE_FRAGMENT or ( if you have to ) CODE_FRAGMENT.",0
5498,"If you mean ``direct ''ByteBuffers, there's a put method which accepts other CODE_FRAGMENT instances so you can copy around.",0
5500,For direct and heap byte buffers CODE_FRAGMENT uses the CODE_FRAGMENT and CODE_FRAGMENT methods.,0
5505,How can i solve it.,0
5509,"Until you create an object and assign it to the variable holding a reference to it, the value of that variable is CODE_FRAGMENT.",0
5512,"Well, you didn't do that for CODE_FRAGMENT object CODE_FRAGMENT.",0
5517,You have to new it up.,0
5519,"Since you are using CODE_FRAGMENT, this will help.",0
5523,I have registered some CellEditors with all my columns.,0
5525,The FILE_NAME looks like this.,0
5537,Check if your Table has that style bit.,0
5539,I added.,0
5548,Here is an example in Java.,0
5551,To get HTTP Response code FILE_NAME.,0
5552,Now you can write your Selenium WebDriver code as below.,0
5559,"After the request is done, all you have to do is get and iterate the Perfomance logs and find ``API_NAME ''for the requested url.",0
5561,The output looks like this.,0
5563,When that is ready I shall post the code.,0
5565,An usage example.,0
5582,While I would expect.,0
5593,"To register the bean, try calling: CODE_FRAGMENT and pass a CODE_FRAGMENT you filled.",0
5613,Session scope population can be done ( ideally using a CODE_FRAGMENT ) using.,0
5615,"In a similar manner, you can populate the request scope ( ideally done in a filter ) using.",0
5635,"my beans are destroyed, How on startup I can get the same bean registered.",0
5637,"As of JUnit there shouldnt be a dependency for your build, right?",0
5640,I Add Junit >> > right click on project - > properties - > Java Build Path - > libraries - > add library.,0
5643,Warning is -.,0
5653,My code follows.,0
5657,Use the SVN Kit library instead.,0
5683,"So in other words, it would be a bug to recieve a non workday in this example.",0
5684,"Store the valid strings in a CODE_FRAGMENT, and decide whether a string is a valid day or not based on CODE_FRAGMENT.",0
5692,Let me know if you need more details.,0
5700,"I know its an old post, but I believe following result will be still interesting.",0
5702,The table below shows time required by simple loop and CODE_FRAGMENT.,0
5708,I'm working with a program that runs lengthy SQL queries and stores the processed results in a HashMap.,0
5720,May be it's worth to limit the 1st level of caching by just 50 reports and introduce a 2nd level based on WeakHashMap?,0
5724,I have a requirement to modify the templates at rumtime.,0
5726,There is a dynamic templating component that is moving from the tapx component library to core Tapestry in NUMBER.,0
5728,Here is a brief description of it.,0
5732,A small description of application is as follow.,0
5733,"The application is basically an object manager, where user add new object, remove old objects and connect object with each other.",0
5738,What Left.,0
5744,cricle and fill that with red.,0
5752,"However, I'd suggest using a graph visualization library like JUNG etc..",0
5753,Using this you'd basically only have to define your object graph.,0
5761,can someone help me how to do this with a piece of code.,0
5777,Thanks in advance to everyone.,0
5779,You have to add FILE_NAME file using eclipse's interface.,0
5780,This website shows how.,0
5789,I had what I believe the same issue is.,0
5790,I found that I needed to adjust the Apache configuration to include a ServerName or ServerAlias for the host.,0
5795,Was being sent from the server to the client.,0
5801,If you can change the code it helps to use CODE_FRAGMENT ( with no host parameter or with a connected socket ).,0
5806,"UPDATE: Actually, it turns out that you CAN supply system properties to the Jarsigner tool, it's just not in the help message.",0
5815,"To allow your programs to work without re-compiling, run your app as.",0
5827,"When you have received the CODE_FRAGMENT warning ( fatal in Java ), retry opening a CODE_FRAGMENT, but this time without a host name.",0
5842,"Alarmingly, my customer has discovered a setting in the Java control panel which resolves this.",0
5849,Our CODE_FRAGMENT was set to the internal host name.,0
5862,Restart your Tomcat ( important ).,0
5863,Just to add a solution here.,0
5868,My CODE_FRAGMENT's CODE_FRAGMENT was commented out by default.,0
5877,The CODE_FRAGMENT header is filled by the CODE_FRAGMENT based on the URL.,0
5880,"Btw, you can also try apache http components.",0
5900,You can also invoke Future #isDone ( ) prior to Future #get ( ) to know if the processing is complete.,0
5905,here is an example hot to use countdownlatch.,0
5908,"If you have access to the configuration of your EJB container and you can set the executor, then you could Guava's addCallback method.",0
5911,"Guava provides a factory method for decorating each ExecutorService as ListeningExecutorService, so you are free to use whatever ExecutorService you had beforehand.",0
5915,I also registered a new tag in CODE_FRAGMENT file as below.,0
5933,"Basically, the component type is mandatory for JSF in order to create the component by CODE_FRAGMENT method.",0
5936,The renderer is selected based on the component family and renderer type by CODE_FRAGMENT.,0
5944,tells JSF that the CODE_FRAGMENT should return an instance of the given FILE_NAME whenever a renderer of the given component family and renderer type is been requested.,0
5951,"I have just a quick question: Are files created before they are finished, or are they finished and then created?",0
5966,How do I get this string into the form of a JSONArray so that I can access it's elements.,0
5971,I'm printing a String.,0
5977,"In the below code, a book time is a period of time in which appointments can be made.",0
5978,"So, the booktime and the appointments in it are getting copied.",0
5983,The book time should be from 20:00 -6:00.,0
5984,whereas on non-daylight savings change day we see.,0
6001,"The length of the appointments, the span of time not yet attached to the timeline, should be handled as a CODE_FRAGMENT object.",0
6004,"Each date for which you want to create an appointment can be represented as a CODE_FRAGMENT, FILE_NAME for a date-only value without a time-of-day and without a time zone.",0
6007,"For example, 8 PM in Auckland NZ is not at all the same moment as 8 PM in Kolkata IN, and different again than 8 PM in Paris FR.",0
6008,You apparently intend these appointments for the time zone of central North America.,0
6018,CODE_FRAGMENT -- How long the appointment should be.,0
6024,"When your are ready to determine an appointment's start and stop times as seen through the lens of some region's wall-clock time, combine those parts above to generate a CODE_FRAGMENT object.",0
6030,Power tip: Stop thinking in any particular time zone.,0
6031,Think of UTC as the ``One True Time ''.,0
6032,We apply a time zone only to report a particular region's wall-clock time to the user.,0
6036,The FILE_NAME represents a moment on the timeline in UTC with a resolution of nanoseconds.,0
6038,Think of an CODE_FRAGMENT as a CODE_FRAGMENT stripped of it assigned time zone.,0
6040,We can extract an CODE_FRAGMENT from each of our pair of CODE_FRAGMENT objects.,0
6048,"The Joda-Time project, now in maintenance mode, advises migration API_NAME.",0
6057,Does anyone know the thinking behind removing this option?,0
6059,"With CODE_FRAGMENT, this example took NUMBER seconds with the option on and NUMBER second with it off in Java 6 update 29.",0
6064,( Should be visible in a couple of days ).,0
6067,It seems Oracle really removed the option.,0
6070,Loading and storing bytes in the byte [ ] consumes 1/2 the bandwidth versus chars in the char [ ].,0
6071,"However, this comes at a price.",0
6076,There is another angle to this.,0
6082,Edit 3/20/2013: An average server heap dump uses 25% of the space on Strings.,0
6083,Most Strings are compressible.,0
6095,I wrote a newsletter about this on The Java Specialists' Newsletter.,0
6099,How to send asynchronous HTTP GET/POST request FILE_NAME without waiting/reading response?,0
6109,the jsonp response looks like.,0
6124,Any Idea how to solve such problem when using CGLIB proxies?,0
6127,Example above produces output.,0
6133,If so we count the number of substrings.,0
6137,API_NAME: String index out of range: 3.,0
6140,"On each iteration through the loop, you're incrementing CODE_FRAGMENT as well as CODE_FRAGMENT.",0
6152,It should point to the exact line number the issue is happening on.,0
6161,list of UIDefaults by @camickr.,0
6172,Use float or double.,0
6183,read here.,0
6186,In the following 2 lines of code.,0
6188,What is context and what is CODE_FRAGMENT?,0
6190,Then what is a CODE_FRAGMENT?,0
6191,While working with netbeans I have to make a new file of category CODE_FRAGMENT.,0
6192,What is a CODE_FRAGMENT and what is a CODE_FRAGMENT?,0
6203,Jar file check following link.,0
6205,Hope it will help you.,0
6218,So what do you think?,0
6221,Its CODE_FRAGMENT method performs the CODE_FRAGMENT / CODE_FRAGMENT test described in the assignment.,0
6222,Your CODE_FRAGMENT method will pass a CODE_FRAGMENT directly to CODE_FRAGMENT.,0
6224,Call it CODE_FRAGMENT or the like.,0
6225,It accepts a regular CODE_FRAGMENT object in its constructor and simply delegates all methods other than CODE_FRAGMENT to the wrapped object.,0
6229,"Since this is homework, here's some hints.",0
6236,"To clarify, a CODE_FRAGMENT object has a method called CODE_FRAGMENT with the following signature.",0
6240,Let's look at a sample call.,0
6248,"You can still compare numerically, which was the goal all along!",0
6254,and finally here is the FILE_NAME.,0
6273,"Assuming instance variables, frst way, EC, CC, PT are ZERO.",0
6280,CODE_FRAGMENT gets the value 1.,0
6289,"No, it's not the same.",0
6294,only HC will be initialized.,0
6295,all variables will be initialized ( with value 1 ).,0
6298,You can also do it as follows.,0
6299,First declare all variables.,0
6300,Then assign value.,0
6302,"If you decalre CODE_FRAGMENT means all EC, CC, PT and HC values are one.",0
6304,Documentation: WEB_ADDRESS.,0
6305,I'm trying to post comments on an app page in Facebook.,0
6310,From what i have found the only API that is almost up to date is RestFB.,0
6319,Is this api up to date?,0
6321,Furthermore is there any other better api?,0
6325,Here is the code that i am using to post a comment.,0
6330,I know the message is posted because i can access it using WEB_ADDRESS Now my new question is.,0
6331,Is this the correct way to display posts on the app page?,0
6340,#NAME?,0
6347,I tried something like this.,0
6348,The result was byte [ ].,0
6356,You can use CODE_FRAGMENT to create a CODE_FRAGMENT from JPEG data.,0
6358,"As an alternative to marking progress in the CODE_FRAGMENT itself, consider decorating it with a CODE_FRAGMENT or a variation.",0
6361,"Note that the GUI's CODE_FRAGMENT can update arbitrary components, and the progress bar can be customized.",0
6363,"Say, after several text appended to a text area, I want this to be appended.",0
6364,"``Please wait, a download is in progress ''.",0
6365,After that a download progress status with progress meter character '#' gets appended.,0
69,Hope that helps some of you with the same problem.,1
137,I would recommend that you check the documentation for what they do.,1
182,When I print the path of the resource using API_NAME ( ''/ resource/API _ NAME'' ) it gives the path correctly as.,1
269,Which we currently are saved from using CODE_FRAGMENT.,1
340,Currently I can't see any performance degradation for 5-10k elements and 2 nodes.,1
423,It even works on Android.,1
424,CODE_FRAGMENT is designed for increased read efficiency ( since this is the primary use of the API ).,1
469,And you're able to use an external configuration file ( no extender needed ) to configure your logging.,1
519,Enabled and pointed my client to a secure port on my container and the last example ( the one that causes the exception ) works successfully.,1
594,It's a good structure for safe publishing of data among threads.,1
654,"Besides increasing your heap, most of the time, it also helps to increase your PermGen space by using the CODE_FRAGMENT paramater.",1
664,You include your if / switch in a Factory which takes care of the ugliness and hides the abundance of ifs.,1
724,APKInspector provides both analysis functions and graphic features for the users to gain deep insight into the malicious apps.,1
743,Problem solved.,1
808,"I suspect it may be more efficient to both query and write your records within each CODE_FRAGMENT, but this is an assumption that would likely require testing.",1
823,"It will do the correct, ``legal ''stuff.",1
910,There is a slight improvement that you can do that uses the CODE_FRAGMENT's internal cache by using its CODE_FRAGMENT method.,1
1011,But in the main case it works good enough.,1
1017,Stable and production ready lib.,1
1036,Not an extremely expensive operation I think.,1
1100,because it provides the lot of flexibility and improvements over using normal arrays.,1
1102,This provides the method CODE_FRAGMENT for inserting the element at specific location and it is very efficient.,1
1103,Whatever you are talking about is best done by the CODE_FRAGMENT WEB_ADDRESS.,1
1167,This will preserve the insertion order and insure no duplicates.,1
1171,They both seem to print out the list fine.,1
1320,Well a solution that works for me.,1
1397,"Finally, an IDE would be helpful for you.",1
1402,"John Spurlock, the create of OData4j, personally responds to almost all of the posts there.",1
1406,"As for iOS development with OData, the best out there is OData4ObjC.",1
1517,"CODE_FRAGMENT overrides these methods, so there is no fear that such an Exception will be thrown.",1
1529,It's ok.,1
1590,Here's a set of solutions to this challenge for both JDK types and Eclipse Collections types using CODE_FRAGMENT.,1
1610,Any of the 5 options listed there should work just fine though.,1
1637,I can assure you it works from within a web app and also within an application using the Spring framework.,1
1648,take a look FILE_NAME executors as these will help with your scheduling and remove the need for the sleep.,1
1683,Useful links.,1
1712,Worked!,1
1726,Javolution Structs supports mapping of off heap memory as a data structure.,1
1774,or more concisely.,1
1879,I suggest you to use.,1
1930,Follow the steps otherwise your code is fine.,1
2137,This works for me.,1
2202,For me this worked.,1
2225,Specifically for bower there looks to be a good maven plugin here.,1
2231,"It does its job, but was built for our use case.",1
2271,That way you don't need to worry about API_NAME.,1
